{
  "schemaVersion": 1,
  "contract": "kfd.protocol-semantics-report/v1",
  "mode": "route",
  "sourceCut": {
    "repository": "kungfu-systems/kfd",
    "package": "@kungfu-tech/kfd",
    "packageVersion": "1.0.0-alpha.70",
    "gitHead": "d0542ea9bb8bfb3ed9004c28bc6629edf0ca21d4",
    "packageManifestRoot": "sha256:081616f54b316ee2f828fe69533b40c7e7862d9212f737fe08aa749a11d011f7",
    "releaseAnchorRoot": "sha256:436e66a3436d6bd147a402ae2fe43153ecc25f6d74c2c0ac5ae28a0821ec6da0",
    "profileManifestRoot": "sha256:2980fbfeb13007b5520c4172ad1a48e9a26e6684ade3b75918fe7238c2a19f82"
  },
  "suite": {
    "id": "delegated-work-paired-worlds",
    "version": "1.0.0",
    "root": "sha256:16ae06cd949db3b02e67a14c9e594e6f0e5a9baa16063946029577045f8c94ec"
  },
  "registry": {
    "root": "sha256:74b218b2d363eab72350cd81d6f49bc0843d722fe30fd233265a5ab4add6081b"
  },
  "route": {
    "id": "commerce-authorization-to-accepted-completion",
    "suiteRoot": "sha256:5be752670ec012894c6820195c76b90e68223ecdab70ef49c94e4247b0ee518e",
    "root": "sha256:cefca37fd47dbfab213be2bf4f0469184acab4f2722371e4c4b6cb16b57ccd4c",
    "verificationRoot": "sha256:44d9bf19bbc7cc69839bd3d769f6493b17ed206996fd950cee9171fb3ebb1aa7"
  },
  "result": {
    "state": "extension-required",
    "resultRoot": "sha256:29594167f8bb4aece8d3df2bf64faa7382ff5e6a7dc999d07d1a883193247af8"
  },
  "claimBoundary": {
    "claim": "evidence-closure-only",
    "informationRepresentationExperiment": true,
    "runtimeAuthority": false,
    "numberedKfdAuthority": false,
    "externalRealityObserved": false,
    "root": "sha256:a413c92424d234e80bd087364e7f565375f83574b0e52f230badf439ed25cbde"
  },
  "residualRisks": {
    "risks": [
      {
        "summary": "The fixed six-pair suite is finite and cannot prove completeness for a real delegated-work system.",
        "root": "sha256:26a326fd5d48802284a1e8eebfed7259ec934106b981c26b278bef387ba3ab55"
      },
      {
        "summary": "A projection can distinguish these fixtures while omitting information required by other worlds.",
        "root": "sha256:eeae547426fb4a5c05d0ad76aecd5308022a531f60c61bc5dd81874bc4a3ef14"
      },
      {
        "summary": "Offline verification detects report and packaged-fixture drift but does not observe a product's production enforcement path.",
        "root": "sha256:0e2ecd2b27ef163c4ca4aba8d59f9038ab7250edc1709072790ce9803d907851"
      },
      {
        "summary": "Adapter responses are self-asserted by the adopter and can misrepresent the mapped product.",
        "root": "sha256:be3ac491dfdd02219fba4457491587d552bed66817fe2303107f7a5c183ed5ce"
      }
    ],
    "root": "sha256:d240cca7465866846a9ff4e036a73bb524087b5aeaae115865995f2da3fef8f7"
  },
  "reportRoot": "sha256:5caa80db0c06159c60c6629bf1c1360a66d1f3e9fccebb584d58a85e60e6b94d"
}
