{
  "schemaVersion": 1,
  "contract": "kfd.protocol-semantics-report/v1",
  "mode": "protocol",
  "sourceCut": {
    "repository": "kungfu-systems/kfd",
    "package": "@kungfu-tech/kfd",
    "packageVersion": "1.0.0-alpha.70",
    "gitHead": "d0542ea9bb8bfb3ed9004c28bc6629edf0ca21d4",
    "packageManifestRoot": "sha256:081616f54b316ee2f828fe69533b40c7e7862d9212f737fe08aa749a11d011f7",
    "releaseAnchorRoot": "sha256:436e66a3436d6bd147a402ae2fe43153ecc25f6d74c2c0ac5ae28a0821ec6da0",
    "profileManifestRoot": "sha256:2980fbfeb13007b5520c4172ad1a48e9a26e6684ade3b75918fe7238c2a19f82"
  },
  "suite": {
    "id": "delegated-work-paired-worlds",
    "version": "1.0.0",
    "root": "sha256:16ae06cd949db3b02e67a14c9e594e6f0e5a9baa16063946029577045f8c94ec"
  },
  "registry": {
    "root": "sha256:74b218b2d363eab72350cd81d6f49bc0843d722fe30fd233265a5ab4add6081b"
  },
  "pack": {
    "protocolId": "a2a-task",
    "protocolVersion": "2026.8.23",
    "root": "sha256:c6e4e9f0dfb92eb182b08681b0698ea43e046814ef09b120cbcb1eb1cab565e0"
  },
  "mapping": {
    "root": "sha256:5d9d99b5358a50c7854cb3dc95230484e0a0dae53fc36c7d15bab953355a8d1f"
  },
  "route": {
    "suiteRoot": "sha256:5be752670ec012894c6820195c76b90e68223ecdab70ef49c94e4247b0ee518e",
    "verificationRoot": "sha256:44d9bf19bbc7cc69839bd3d769f6493b17ed206996fd950cee9171fb3ebb1aa7"
  },
  "fixture": {
    "id": "a2a-retry-preserved",
    "source": "profiles/protocol-semantics-lab/fixtures/adapters/valid/a2a-retry-preserved.json",
    "byteRoot": "sha256:0e9b06fcda36696c3b7a06fdec26292233811e9d5d5375465a58f93df86cf490",
    "documentRoot": "sha256:0ce4170ce2a2187394dd6565bf7405980aa5b3e424c614b0822de878c5dbdcd1"
  },
  "adapter": {
    "id": "a2a-task-observation-adapter",
    "version": "0.1.0",
    "artifactRoot": "sha256:6019a86a51878e74de2e05c591f77d13aa12c8d51c698ef0abcf38cd6b4effbe"
  },
  "transcript": {
    "root": "sha256:7efd0d9901a2b1040a4ef79dc8406955f5558c07c18779deb5fc40fb28508590"
  },
  "result": {
    "state": "preserved",
    "observationRoot": "sha256:68302ae5d7dc4050adf824d12b9ceebaf78f95f03914e30c76683d0cb0e21131",
    "resultRoot": "sha256:1cd8f35e0f8e04452a212bfcad0a55bf42cce0e3b299a7c85e956f0ddc017e59"
  },
  "observation": {
    "schemaVersion": 1,
    "contract": "kfd.protocol-observation/v2",
    "id": "a2a-retry-preserved",
    "protocol": {
      "protocolId": "a2a-task",
      "protocolVersion": "2026.8.23",
      "evidencePackRoot": "sha256:c6e4e9f0dfb92eb182b08681b0698ea43e046814ef09b120cbcb1eb1cab565e0"
    },
    "fixture": {
      "id": "a2a-retry-preserved",
      "inputRoot": "sha256:0ce4170ce2a2187394dd6565bf7405980aa5b3e424c614b0822de878c5dbdcd1"
    },
    "adapter": {
      "id": "a2a-task-observation-adapter",
      "version": "0.1.0",
      "artifactRoot": "sha256:6019a86a51878e74de2e05c591f77d13aa12c8d51c698ef0abcf38cd6b4effbe"
    },
    "scenario": {
      "kind": "retry",
      "identityPreservation": "preserved"
    },
    "facts": [
      {
        "id": "accepted-completion",
        "state": "extension-required",
        "source": {
          "status": "absent",
          "reason": "extension-required"
        },
        "evidenceRoots": []
      },
      {
        "id": "authority-id",
        "state": "unresolved",
        "source": {
          "status": "absent",
          "reason": "not-represented"
        },
        "evidenceRoots": []
      },
      {
        "id": "executor-id",
        "state": "represented",
        "source": {
          "status": "native",
          "eventId": "event-2",
          "coordinate": "/events/1/payload/executorId"
        },
        "evidenceRoots": [
          "sha256:96f142ba9ada8fec521d8c91b99cc969d45ec70e3034e0d87e4ff64d1cb7dfed"
        ],
        "value": "executor-b"
      },
      {
        "id": "operation-state",
        "state": "represented",
        "source": {
          "status": "native",
          "eventId": "event-2",
          "coordinate": "/events/1/payload/status"
        },
        "evidenceRoots": [
          "sha256:c3f63a1e120c44bb29f59d064364b001246cf29de486ae564837558cf188801e"
        ],
        "value": "working"
      },
      {
        "id": "protocol-object-id",
        "state": "represented",
        "source": {
          "status": "native",
          "eventId": "event-2",
          "coordinate": "/events/1/payload/taskId"
        },
        "evidenceRoots": [
          "sha256:f1b049e2905f48876b833349fbdfbe58042ee6c77c58c9465f2892c8e0fa94d7"
        ],
        "value": "task-b"
      },
      {
        "id": "recovery-drift",
        "state": "represented",
        "source": {
          "status": "native",
          "eventId": "event-2",
          "coordinate": "/events/1/payload/executorId"
        },
        "evidenceRoots": [
          "sha256:f4df5fb47185c3f9d57a2268223734a10e9c0b814b141bb7e94d52fddc61753c"
        ],
        "value": "executor-replaced"
      },
      {
        "id": "resume-identity",
        "state": "unresolved",
        "source": {
          "status": "absent",
          "reason": "not-represented"
        },
        "evidenceRoots": []
      },
      {
        "id": "retry-identity",
        "state": "represented",
        "source": {
          "status": "native",
          "eventId": "event-2",
          "coordinate": "/events/1/payload/retryOf"
        },
        "evidenceRoots": [
          "sha256:ab31c65b95d4428077fdca119ad97bf6b386a51b1602fb694c0bdc5398516882"
        ],
        "value": "task-a"
      },
      {
        "id": "work-id",
        "state": "extension-required",
        "source": {
          "status": "absent",
          "reason": "extension-required"
        },
        "evidenceRoots": []
      },
      {
        "id": "work-version",
        "state": "extension-required",
        "source": {
          "status": "absent",
          "reason": "extension-required"
        },
        "evidenceRoots": []
      }
    ],
    "transcriptRoot": "sha256:7efd0d9901a2b1040a4ef79dc8406955f5558c07c18779deb5fc40fb28508590",
    "claimBoundary": {
      "normalizedObservationOnly": true,
      "nativeCoordinatesRequired": true,
      "inferenceAllowed": false,
      "certification": false,
      "runtimeAuthority": false,
      "policyCorrectness": false
    }
  },
  "claimBoundary": {
    "claim": "evidence-closure-only",
    "informationRepresentationExperiment": true,
    "runtimeAuthority": false,
    "numberedKfdAuthority": false,
    "externalRealityObserved": false,
    "root": "sha256:a413c92424d234e80bd087364e7f565375f83574b0e52f230badf439ed25cbde"
  },
  "residualRisks": {
    "risks": [
      {
        "summary": "The fixed six-pair suite is finite and cannot prove completeness for a real delegated-work system.",
        "root": "sha256:26a326fd5d48802284a1e8eebfed7259ec934106b981c26b278bef387ba3ab55"
      },
      {
        "summary": "A projection can distinguish these fixtures while omitting information required by other worlds.",
        "root": "sha256:eeae547426fb4a5c05d0ad76aecd5308022a531f60c61bc5dd81874bc4a3ef14"
      },
      {
        "summary": "Offline verification detects report and packaged-fixture drift but does not observe a product's production enforcement path.",
        "root": "sha256:0e2ecd2b27ef163c4ca4aba8d59f9038ab7250edc1709072790ce9803d907851"
      },
      {
        "summary": "Adapter responses are self-asserted by the adopter and can misrepresent the mapped product.",
        "root": "sha256:be3ac491dfdd02219fba4457491587d552bed66817fe2303107f7a5c183ed5ce"
      }
    ],
    "root": "sha256:d240cca7465866846a9ff4e036a73bb524087b5aeaae115865995f2da3fef8f7"
  },
  "reportRoot": "sha256:39563e050afc8862cc08596a3f699814a6eb8ced4c0ea5567d5f759628b08e49"
}
